title,company,start_date,end_date,linkedin_company_url,skills,certifications,languages,name,location,area,industry,picture,organizations,groups,education,websites,profile_url,summary,current,timestamp,related_people,degree,pic_path,description,score
"Russian Linguist (translator, interpreter, editor, consultant)",Various Companies,1990-01-01,2015-05-25,http://www.linkedin.com/,"[""Translation"", ""Russian"", ""Technical Translation"", ""Language Services"", ""Multilingual"", ""Localization"", ""Linguistics"", ""Interpreting"", ""Consecutive..."", ""Foreign Languages"", ""English"", ""Trados"", ""Proofreading"", ""Editing"", ""International Relations"", ""Language Teaching"", ""Medical Translation"", ""Legal Translation"", ""Wordfast"", ""Simultaneous..."", ""Conference Interpreting"", ""Intercultural..."", ""Literature"", ""Internationalization"", ""Transcription"", ""Website Localization"", ""Globalization"", ""Terminology"", ""Manuals"", ""Subtitling"", ""Video Editing"", ""Audio Editing"", ""Travel"", ""Microsoft Office"", ""Leadership"", ""Management""]",[],"[{""language""=>""English"", ""proficiency""=>""Native or bilingual proficiency""}, {""language""=>""Russian"", ""proficiency""=>""Native or bilingual proficiency""}]",Alexander Misailov,Keller,Texas,Translation and Localization,https://media.licdn.com/mpr/mpr/shrinknp_400_400/p/8/000/287/2a8/33ea4f5.jpg,[],[],"[{""name""=>""KGPU"", ""description""=>""MA, Modern Languages"", ""period""=>""""}]",[],http://www.linkedin.com/pub/alexander-misailov/25/1b8/328,"Master's degree in Modern Languages and over 24 years of experience. Professional Russian-English and English-Russian translations, interpretation, cryptologic analysis, consulting, editing, reviewing, and proof reading work. Specialties: Aerospace, technical, oil and gas, military, military hardware and materiel, communications systems, Title III intercepts, IT, localization, marketing, environmental, biological and nuclear threat management, manufacturing, legal, business; video/audio recording, editing, and subtitling. Member of the UN Russian Editor Roster. Sample Clients (among others): - Aerojet Rocketdyne - DTRA, DOD, DEA, FBI, NVTC - Emerson - ExxonMobil - Gazprom Neft - Intel - NASA - Orbital Sciences Corporation - PepsiCo - Pratt & Whitney - Salt Lake Olympic Organizing Committee - Sea Launch - Seagate - Symantec - TMK IPSCO - ULA Sample Projects (among others): - Aerospace: interpretation and translation (Antares, Atlas V, RD-180, Zenit-3SL, satellites, spacecraft, operations support, real-time launch support, ICD, FRR, ERB, IDCR, SOW, international telecons) - Biorisk and biosafety - Oil and Gas: Emerson Global Users Exchange, Halliburton, OCTG pipe manufacturing; various well equipment - Seagate Barracuda hard-drive - Title III - Voice-overs (including training videos for PepsiCo) - 2001 Winter Olympic Games High level proficiency in Word processing in English and Russian, and working knowledge of such programs and applications as MS Office, Wordfast (CAT tool), Adobe Acrobat Pro, Adobe Premier Pro, Adobe Photoshop. Online terminology and subject matter research. The ability to organize and prioritize, work with no or minimal supervision, leadership, meeting objectives and goals under pressure and deadlines, attention to detail, self motivation, the ability to conduct detailed search and research, and developed written and oral communication skills are among my strongest professional qualities and personal traits.",Yes,2015-05-17 11:25:44 -0700,[],0,public/uploads/pictures/33ea4f5.jpg,,0
Expert Ukrainian and Russian Language Analyst. Ukraine subject-matter expert,Free lance,1997-01-01,,http://www.linkedin.com/,"[""Russian"", ""Translation"", ""Interpreting"", ""Ukrainian"", ""European Union"", ""ESL"", ""Linguistics""]",[],[],Inna Dubovik-Sileo PhD,West Palm Beach,Florida Area,Legal Services,https://media.licdn.com/media/p/3/000/084/0c6/201f3f4.jpg,[],"[{""name""=>""Russian translators"", ""link""=>""http://www.linkedin.comhttp://www.linkedin.com/groups?gid=2455580&goback=%2Enpp_inna*5dubovik*5sileo*5phd%2F10%2Fa33%2Fa6&trk=fulpro_grplogo""}, {""name""=>""Forensic Linguistic Evidence"", ""link""=>""http://www.linkedin.comhttp://www.linkedin.com/groups?gid=4606264&goback=%2Enpp_inna*5dubovik*5sileo*5phd%2F10%2Fa33%2Fa6&trk=fulpro_grplogo""}]","[{""name""=>""FBI Academy, Quantico, VA"", ""description""=>""certificate, cyber crime"", ""period""=>""2009 – 2009""}, {""name""=>""Monterey Institute of International Studies"", ""description""=>"""", ""period""=>""2009 – 2009""}, {""name""=>""Tbilisi State University"", ""description""=>""PhD, American Literature/English as a Second Language"", ""period""=>""1989 – 1990""}, {""name""=>""Dniepropetrovsk State University"", ""description""=>""Masters Magna Cum Laude, English Language/Literature"", ""period""=>""1981 – 1986""}]",[],http://www.linkedin.com/pub/inna-dubovik-sileo-phd/10/a33/a6,,Yes,2015-05-17 11:26:35 -0700,"[{""name""=>""Daniela Dumitru"", ""url""=>""https://www.linkedin.com/pub/daniela-dumitru/90/162/499?trk=pub-pbmap""}, {""name""=>""Van Garner"", ""url""=>""https://www.linkedin.com/pub/van-garner/41/664/139?trk=pub-pbmap""}, {""name""=>""Platon Guryanov"", ""url""=>""https://www.linkedin.com/pub/platon-guryanov/11/963/4a5?trk=pub-pbmap""}, {""name""=>""Stella Phunkulh"", ""url""=>""https://www.linkedin.com/pub/stella-phunkulh/41/918/563?trk=pub-pbmap""}, {""name""=>""Fazal Karim Fazal"", ""url""=>""https://www.linkedin.com/pub/fazal-karim-fazal/53/140/9a5?trk=pub-pbmap""}, {""name""=>""Milena Barroso"", ""url""=>""https://www.linkedin.com/pub/milena-barroso/a6/291/a1?trk=pub-pbmap""}, {""name""=>""Gloria Moncayo"", ""url""=>""https://www.linkedin.com/pub/gloria-moncayo/b3/a33/165?trk=pub-pbmap""}, {""name""=>""Janelle Elizabeth Urban"", ""url""=>""https://www.linkedin.com/pub/janelle-elizabeth-urban/2a/766/a06?trk=pub-pbmap""}, {""name""=>""Gustavo Negrete"", ""url""=>""https://www.linkedin.com/pub/gustavo-negrete/6a/656/6b0?trk=pub-pbmap""}, {""name""=>""Elena Patrascu"", ""url""=>""https://www.linkedin.com/pub/elena-patrascu/56/b8a/35b?trk=pub-pbmap""}]",0,public/uploads/pictures/201f3f4.jpg,"Expert Linguist Expert Witness White Collar Crimes Interpreting and translations Ukrainian Linguist Russian Linguist Country Analyst, SME on Ukraine Federal Bureau of Investigation, Houston TX, Dallas TX, Miami & West Palm Beach, FL US District Court, Miami FL DEA, South Florida US Attorney's Office (Southern District of FL) NASA George Marshall Center for Security Studies/College of International & Security Studies, Garmisch, Germany International Foundation of Election Systems (IACREOT) Grand Jury, US District Court, Miami FL Sikorsky Aircraft State Department",0
"Contract Linguist, Russian and Ukrainian Languages, Quality Control Reviewer, Interpreter",Government Agency,2000-01-01,2010-09-10,http://www.linkedin.com/,"[""Russian"", ""Translation"", ""Interpreting"", ""Ukrainian"", ""European Union"", ""ESL"", ""Linguistics""]",[],[],Inna Dubovik-Sileo PhD,West Palm Beach,Florida Area,Legal Services,https://media.licdn.com/media/p/3/000/084/0c6/201f3f4.jpg,[],"[{""name""=>""Russian translators"", ""link""=>""http://www.linkedin.comhttp://www.linkedin.com/groups?gid=2455580&goback=%2Enpp_inna*5dubovik*5sileo*5phd%2F10%2Fa33%2Fa6&trk=fulpro_grplogo""}, {""name""=>""Forensic Linguistic Evidence"", ""link""=>""http://www.linkedin.comhttp://www.linkedin.com/groups?gid=4606264&goback=%2Enpp_inna*5dubovik*5sileo*5phd%2F10%2Fa33%2Fa6&trk=fulpro_grplogo""}]","[{""name""=>""FBI Academy, Quantico, VA"", ""description""=>""certificate, cyber crime"", ""period""=>""2009 – 2009""}, {""name""=>""Monterey Institute of International Studies"", ""description""=>"""", ""period""=>""2009 – 2009""}, {""name""=>""Tbilisi State University"", ""description""=>""PhD, American Literature/English as a Second Language"", ""period""=>""1989 – 1990""}, {""name""=>""Dniepropetrovsk State University"", ""description""=>""Masters Magna Cum Laude, English Language/Literature"", ""period""=>""1981 – 1986""}]",[],http://www.linkedin.com/pub/inna-dubovik-sileo-phd/10/a33/a6,,No,2015-05-17 11:26:35 -0700,"[{""name""=>""Daniela Dumitru"", ""url""=>""https://www.linkedin.com/pub/daniela-dumitru/90/162/499?trk=pub-pbmap""}, {""name""=>""Van Garner"", ""url""=>""https://www.linkedin.com/pub/van-garner/41/664/139?trk=pub-pbmap""}, {""name""=>""Platon Guryanov"", ""url""=>""https://www.linkedin.com/pub/platon-guryanov/11/963/4a5?trk=pub-pbmap""}, {""name""=>""Stella Phunkulh"", ""url""=>""https://www.linkedin.com/pub/stella-phunkulh/41/918/563?trk=pub-pbmap""}, {""name""=>""Fazal Karim Fazal"", ""url""=>""https://www.linkedin.com/pub/fazal-karim-fazal/53/140/9a5?trk=pub-pbmap""}, {""name""=>""Milena Barroso"", ""url""=>""https://www.linkedin.com/pub/milena-barroso/a6/291/a1?trk=pub-pbmap""}, {""name""=>""Gloria Moncayo"", ""url""=>""https://www.linkedin.com/pub/gloria-moncayo/b3/a33/165?trk=pub-pbmap""}, {""name""=>""Janelle Elizabeth Urban"", ""url""=>""https://www.linkedin.com/pub/janelle-elizabeth-urban/2a/766/a06?trk=pub-pbmap""}, {""name""=>""Gustavo Negrete"", ""url""=>""https://www.linkedin.com/pub/gustavo-negrete/6a/656/6b0?trk=pub-pbmap""}, {""name""=>""Elena Patrascu"", ""url""=>""https://www.linkedin.com/pub/elena-patrascu/56/b8a/35b?trk=pub-pbmap""}]",0,public/uploads/pictures/201f3f4.jpg,Certified Russian and Ukrainian translator Certified Russian and Ukrainian interpreter (consecutive/simultaneous) Certified Quality Control Reviewer in Russian and Ukrainian Languages,0
Interpreter Ukranian/Russian Languages,TACIS,1995-05-01,1996-02-10,http://www.linkedin.com/,"[""Russian"", ""Translation"", ""Interpreting"", ""Ukrainian"", ""European Union"", ""ESL"", ""Linguistics""]",[],[],Inna Dubovik-Sileo PhD,West Palm Beach,Florida Area,Legal Services,https://media.licdn.com/media/p/3/000/084/0c6/201f3f4.jpg,[],"[{""name""=>""Russian translators"", ""link""=>""http://www.linkedin.comhttp://www.linkedin.com/groups?gid=2455580&goback=%2Enpp_inna*5dubovik*5sileo*5phd%2F10%2Fa33%2Fa6&trk=fulpro_grplogo""}, {""name""=>""Forensic Linguistic Evidence"", ""link""=>""http://www.linkedin.comhttp://www.linkedin.com/groups?gid=4606264&goback=%2Enpp_inna*5dubovik*5sileo*5phd%2F10%2Fa33%2Fa6&trk=fulpro_grplogo""}]","[{""name""=>""FBI Academy, Quantico, VA"", ""description""=>""certificate, cyber crime"", ""period""=>""2009 – 2009""}, {""name""=>""Monterey Institute of International Studies"", ""description""=>"""", ""period""=>""2009 – 2009""}, {""name""=>""Tbilisi State University"", ""description""=>""PhD, American Literature/English as a Second Language"", ""period""=>""1989 – 1990""}, {""name""=>""Dniepropetrovsk State University"", ""description""=>""Masters Magna Cum Laude, English Language/Literature"", ""period""=>""1981 – 1986""}]",[],http://www.linkedin.com/pub/inna-dubovik-sileo-phd/10/a33/a6,,No,2015-05-17 11:26:35 -0700,"[{""name""=>""Daniela Dumitru"", ""url""=>""https://www.linkedin.com/pub/daniela-dumitru/90/162/499?trk=pub-pbmap""}, {""name""=>""Van Garner"", ""url""=>""https://www.linkedin.com/pub/van-garner/41/664/139?trk=pub-pbmap""}, {""name""=>""Platon Guryanov"", ""url""=>""https://www.linkedin.com/pub/platon-guryanov/11/963/4a5?trk=pub-pbmap""}, {""name""=>""Stella Phunkulh"", ""url""=>""https://www.linkedin.com/pub/stella-phunkulh/41/918/563?trk=pub-pbmap""}, {""name""=>""Fazal Karim Fazal"", ""url""=>""https://www.linkedin.com/pub/fazal-karim-fazal/53/140/9a5?trk=pub-pbmap""}, {""name""=>""Milena Barroso"", ""url""=>""https://www.linkedin.com/pub/milena-barroso/a6/291/a1?trk=pub-pbmap""}, {""name""=>""Gloria Moncayo"", ""url""=>""https://www.linkedin.com/pub/gloria-moncayo/b3/a33/165?trk=pub-pbmap""}, {""name""=>""Janelle Elizabeth Urban"", ""url""=>""https://www.linkedin.com/pub/janelle-elizabeth-urban/2a/766/a06?trk=pub-pbmap""}, {""name""=>""Gustavo Negrete"", ""url""=>""https://www.linkedin.com/pub/gustavo-negrete/6a/656/6b0?trk=pub-pbmap""}, {""name""=>""Elena Patrascu"", ""url""=>""https://www.linkedin.com/pub/elena-patrascu/56/b8a/35b?trk=pub-pbmap""}]",0,public/uploads/pictures/201f3f4.jpg,"EU Technical Assistance for the countries of the former Soviet Union Liaison/interpreter for the Ministries of Industry, Finance, Agriculture, Economics and Energy of Ukraine in connection with investment projects for oil and gas exploration, farming, insurance industry, banking industry.",0
Interpreter and Translator/ Liaison,"Marine and Mercantile Securities Petroleum Services, UK",1995-01-01,,http://www.linkedin.com/,"[""Russian"", ""Translation"", ""Interpreting"", ""Ukrainian"", ""European Union"", ""ESL"", ""Linguistics""]",[],[],Inna Dubovik-Sileo PhD,West Palm Beach,Florida Area,Legal Services,https://media.licdn.com/media/p/3/000/084/0c6/201f3f4.jpg,[],"[{""name""=>""Russian translators"", ""link""=>""http://www.linkedin.comhttp://www.linkedin.com/groups?gid=2455580&goback=%2Enpp_inna*5dubovik*5sileo*5phd%2F10%2Fa33%2Fa6&trk=fulpro_grplogo""}, {""name""=>""Forensic Linguistic Evidence"", ""link""=>""http://www.linkedin.comhttp://www.linkedin.com/groups?gid=4606264&goback=%2Enpp_inna*5dubovik*5sileo*5phd%2F10%2Fa33%2Fa6&trk=fulpro_grplogo""}]","[{""name""=>""FBI Academy, Quantico, VA"", ""description""=>""certificate, cyber crime"", ""period""=>""2009 – 2009""}, {""name""=>""Monterey Institute of International Studies"", ""description""=>"""", ""period""=>""2009 – 2009""}, {""name""=>""Tbilisi State University"", ""description""=>""PhD, American Literature/English as a Second Language"", ""period""=>""1989 – 1990""}, {""name""=>""Dniepropetrovsk State University"", ""description""=>""Masters Magna Cum Laude, English Language/Literature"", ""period""=>""1981 – 1986""}]",[],http://www.linkedin.com/pub/inna-dubovik-sileo-phd/10/a33/a6,,No,2015-05-17 11:26:35 -0700,"[{""name""=>""Daniela Dumitru"", ""url""=>""https://www.linkedin.com/pub/daniela-dumitru/90/162/499?trk=pub-pbmap""}, {""name""=>""Van Garner"", ""url""=>""https://www.linkedin.com/pub/van-garner/41/664/139?trk=pub-pbmap""}, {""name""=>""Platon Guryanov"", ""url""=>""https://www.linkedin.com/pub/platon-guryanov/11/963/4a5?trk=pub-pbmap""}, {""name""=>""Stella Phunkulh"", ""url""=>""https://www.linkedin.com/pub/stella-phunkulh/41/918/563?trk=pub-pbmap""}, {""name""=>""Fazal Karim Fazal"", ""url""=>""https://www.linkedin.com/pub/fazal-karim-fazal/53/140/9a5?trk=pub-pbmap""}, {""name""=>""Milena Barroso"", ""url""=>""https://www.linkedin.com/pub/milena-barroso/a6/291/a1?trk=pub-pbmap""}, {""name""=>""Gloria Moncayo"", ""url""=>""https://www.linkedin.com/pub/gloria-moncayo/b3/a33/165?trk=pub-pbmap""}, {""name""=>""Janelle Elizabeth Urban"", ""url""=>""https://www.linkedin.com/pub/janelle-elizabeth-urban/2a/766/a06?trk=pub-pbmap""}, {""name""=>""Gustavo Negrete"", ""url""=>""https://www.linkedin.com/pub/gustavo-negrete/6a/656/6b0?trk=pub-pbmap""}, {""name""=>""Elena Patrascu"", ""url""=>""https://www.linkedin.com/pub/elena-patrascu/56/b8a/35b?trk=pub-pbmap""}]",0,public/uploads/pictures/201f3f4.jpg,Oil and Gas Exploration Investment Projects in Ukraine and Russia,0
Researcher/project manager/interpreter,Surrey University,1993-01-01,,http://www.linkedin.com/,"[""Russian"", ""Translation"", ""Interpreting"", ""Ukrainian"", ""European Union"", ""ESL"", ""Linguistics""]",[],[],Inna Dubovik-Sileo PhD,West Palm Beach,Florida Area,Legal Services,https://media.licdn.com/media/p/3/000/084/0c6/201f3f4.jpg,[],"[{""name""=>""Russian translators"", ""link""=>""http://www.linkedin.comhttp://www.linkedin.com/groups?gid=2455580&goback=%2Enpp_inna*5dubovik*5sileo*5phd%2F10%2Fa33%2Fa6&trk=fulpro_grplogo""}, {""name""=>""Forensic Linguistic Evidence"", ""link""=>""http://www.linkedin.comhttp://www.linkedin.com/groups?gid=4606264&goback=%2Enpp_inna*5dubovik*5sileo*5phd%2F10%2Fa33%2Fa6&trk=fulpro_grplogo""}]","[{""name""=>""FBI Academy, Quantico, VA"", ""description""=>""certificate, cyber crime"", ""period""=>""2009 – 2009""}, {""name""=>""Monterey Institute of International Studies"", ""description""=>"""", ""period""=>""2009 – 2009""}, {""name""=>""Tbilisi State University"", ""description""=>""PhD, American Literature/English as a Second Language"", ""period""=>""1989 – 1990""}, {""name""=>""Dniepropetrovsk State University"", ""description""=>""Masters Magna Cum Laude, English Language/Literature"", ""period""=>""1981 – 1986""}]",[],http://www.linkedin.com/pub/inna-dubovik-sileo-phd/10/a33/a6,,No,2015-05-17 11:26:35 -0700,"[{""name""=>""Daniela Dumitru"", ""url""=>""https://www.linkedin.com/pub/daniela-dumitru/90/162/499?trk=pub-pbmap""}, {""name""=>""Van Garner"", ""url""=>""https://www.linkedin.com/pub/van-garner/41/664/139?trk=pub-pbmap""}, {""name""=>""Platon Guryanov"", ""url""=>""https://www.linkedin.com/pub/platon-guryanov/11/963/4a5?trk=pub-pbmap""}, {""name""=>""Stella Phunkulh"", ""url""=>""https://www.linkedin.com/pub/stella-phunkulh/41/918/563?trk=pub-pbmap""}, {""name""=>""Fazal Karim Fazal"", ""url""=>""https://www.linkedin.com/pub/fazal-karim-fazal/53/140/9a5?trk=pub-pbmap""}, {""name""=>""Milena Barroso"", ""url""=>""https://www.linkedin.com/pub/milena-barroso/a6/291/a1?trk=pub-pbmap""}, {""name""=>""Gloria Moncayo"", ""url""=>""https://www.linkedin.com/pub/gloria-moncayo/b3/a33/165?trk=pub-pbmap""}, {""name""=>""Janelle Elizabeth Urban"", ""url""=>""https://www.linkedin.com/pub/janelle-elizabeth-urban/2a/766/a06?trk=pub-pbmap""}, {""name""=>""Gustavo Negrete"", ""url""=>""https://www.linkedin.com/pub/gustavo-negrete/6a/656/6b0?trk=pub-pbmap""}, {""name""=>""Elena Patrascu"", ""url""=>""https://www.linkedin.com/pub/elena-patrascu/56/b8a/35b?trk=pub-pbmap""}]",0,public/uploads/pictures/201f3f4.jpg,"Department of Education, Surrey University, Guildford, UK Organized logistics/ administrative services/interpreting for students exchange, training of teachers and facilitated meetings between UK business community (financial services, banking, insurance) and Russian and Ukrainian Universities.",0
Associate Professor,Dniepropetrovsk University,1989-01-01,,http://www.linkedin.com/,"[""Russian"", ""Translation"", ""Interpreting"", ""Ukrainian"", ""European Union"", ""ESL"", ""Linguistics""]",[],[],Inna Dubovik-Sileo PhD,West Palm Beach,Florida Area,Legal Services,https://media.licdn.com/media/p/3/000/084/0c6/201f3f4.jpg,[],"[{""name""=>""Russian translators"", ""link""=>""http://www.linkedin.comhttp://www.linkedin.com/groups?gid=2455580&goback=%2Enpp_inna*5dubovik*5sileo*5phd%2F10%2Fa33%2Fa6&trk=fulpro_grplogo""}, {""name""=>""Forensic Linguistic Evidence"", ""link""=>""http://www.linkedin.comhttp://www.linkedin.com/groups?gid=4606264&goback=%2Enpp_inna*5dubovik*5sileo*5phd%2F10%2Fa33%2Fa6&trk=fulpro_grplogo""}]","[{""name""=>""FBI Academy, Quantico, VA"", ""description""=>""certificate, cyber crime"", ""period""=>""2009 – 2009""}, {""name""=>""Monterey Institute of International Studies"", ""description""=>"""", ""period""=>""2009 – 2009""}, {""name""=>""Tbilisi State University"", ""description""=>""PhD, American Literature/English as a Second Language"", ""period""=>""1989 – 1990""}, {""name""=>""Dniepropetrovsk State University"", ""description""=>""Masters Magna Cum Laude, English Language/Literature"", ""period""=>""1981 – 1986""}]",[],http://www.linkedin.com/pub/inna-dubovik-sileo-phd/10/a33/a6,,No,2015-05-17 11:26:35 -0700,"[{""name""=>""Daniela Dumitru"", ""url""=>""https://www.linkedin.com/pub/daniela-dumitru/90/162/499?trk=pub-pbmap""}, {""name""=>""Van Garner"", ""url""=>""https://www.linkedin.com/pub/van-garner/41/664/139?trk=pub-pbmap""}, {""name""=>""Platon Guryanov"", ""url""=>""https://www.linkedin.com/pub/platon-guryanov/11/963/4a5?trk=pub-pbmap""}, {""name""=>""Stella Phunkulh"", ""url""=>""https://www.linkedin.com/pub/stella-phunkulh/41/918/563?trk=pub-pbmap""}, {""name""=>""Fazal Karim Fazal"", ""url""=>""https://www.linkedin.com/pub/fazal-karim-fazal/53/140/9a5?trk=pub-pbmap""}, {""name""=>""Milena Barroso"", ""url""=>""https://www.linkedin.com/pub/milena-barroso/a6/291/a1?trk=pub-pbmap""}, {""name""=>""Gloria Moncayo"", ""url""=>""https://www.linkedin.com/pub/gloria-moncayo/b3/a33/165?trk=pub-pbmap""}, {""name""=>""Janelle Elizabeth Urban"", ""url""=>""https://www.linkedin.com/pub/janelle-elizabeth-urban/2a/766/a06?trk=pub-pbmap""}, {""name""=>""Gustavo Negrete"", ""url""=>""https://www.linkedin.com/pub/gustavo-negrete/6a/656/6b0?trk=pub-pbmap""}, {""name""=>""Elena Patrascu"", ""url""=>""https://www.linkedin.com/pub/elena-patrascu/56/b8a/35b?trk=pub-pbmap""}]",0,public/uploads/pictures/201f3f4.jpg,"Teaching of English as a Second Language at the Department of Law, History, and Political Science",0
Russian Linguist,FCI Translations,2012-01-01,2015-05-18,http://www.linkedin.com/,"[""Translation"", ""Interpretation"", ""Proofreading"", ""Subtitling"", ""Voice Over"", ""Microsoft Office"", ""SDL Trados"", ""Internet"", ""Virtual Assistance"", ""Language Services"", ""Technical Translation""]",[],[],Alina Mills,Burton,Michigan,Translation and Localization,https://media.licdn.com/mpr/mpr/shrinknp_400_400/p/3/000/1db/0e9/1c9611c.jpg,[],"[{""name""=>""www.nslist.org Translation job list, part time, full time, post jobs for free, daily update"", ""link""=>""http://www.linkedin.comhttp://www.linkedin.com/groups?gid=6581120&goback=%2Enpp_alina*5mills%2F62%2F2a7%2F133&trk=fulpro_grplogo""}, {""name""=>""Certified Translator Professional"", ""link""=>""http://www.linkedin.comhttp://www.linkedin.com/groups?gid=6609710&goback=%2Enpp_alina*5mills%2F62%2F2a7%2F133&trk=fulpro_grplogo""}]","[{""name""=>""Sumy State University"", ""description""=>""MA, Foreign Languages and Literatures, General"", ""period""=>""2004 – 2009""}, {""name""=>""Mott Community College"", ""description""=>"""", ""period""=>""""}]",[],http://www.linkedin.com/pub/alina-mills/62/2a7/133,,Yes,2015-05-17 11:27:29 -0700,"[{""name""=>""Max Argunov"", ""url""=>""https://www.linkedin.com/pub/max-argunov/61/882/767?trk=pub-pbmap""}, {""name""=>""Kseniya Medvedeva"", ""url""=>""https://www.linkedin.com/pub/kseniya-medvedeva/5a/51a/3b4?trk=pub-pbmap""}, {""name""=>""Galyna Sturm"", ""url""=>""https://www.linkedin.com/pub/galyna-sturm/7/805/97?trk=pub-pbmap""}, {""name""=>""Daria Shyman"", ""url""=>""https://www.linkedin.com/pub/daria-shyman/76/383/893?trk=pub-pbmap""}, {""name""=>""Anna Prokopenko"", ""url""=>""https://www.linkedin.com/pub/anna-prokopenko/8a/b25/501?trk=pub-pbmap""}, {""name""=>""Nadia Tratch"", ""url""=>""https://www.linkedin.com/pub/nadia-tratch/24/971/130?trk=pub-pbmap""}, {""name""=>""Yulia Girina"", ""url""=>""https://www.linkedin.com/pub/yulia-girina/54/80/169?trk=pub-pbmap""}, {""name""=>""Eugenia Belonogova"", ""url""=>""https://www.linkedin.com/pub/eugenia-belonogova/1/427/394?trk=pub-pbmap""}, {""name""=>""Oleg Sylvestrov"", ""url""=>""https://www.linkedin.com/pub/oleg-sylvestrov/17/249/29b?trk=pub-pbmap""}, {""name""=>""Artyom Fomenko"", ""url""=>""https://www.linkedin.com/pub/artyom-fomenko/42/120/915?trk=pub-pbmap""}]",0,public/uploads/pictures/1c9611c.jpg,"English to Russian, Russian to English translator and proofreader for FCI Translations.",0
"Content writer, translator and proofreader",Gambling website,2012-01-01,2013-02-01,http://www.linkedin.com/,"[""Translation"", ""Interpretation"", ""Proofreading"", ""Subtitling"", ""Voice Over"", ""Microsoft Office"", ""SDL Trados"", ""Internet"", ""Virtual Assistance"", ""Language Services"", ""Technical Translation""]",[],[],Alina Mills,Burton,Michigan,Translation and Localization,https://media.licdn.com/mpr/mpr/shrinknp_400_400/p/3/000/1db/0e9/1c9611c.jpg,[],"[{""name""=>""www.nslist.org Translation job list, part time, full time, post jobs for free, daily update"", ""link""=>""http://www.linkedin.comhttp://www.linkedin.com/groups?gid=6581120&goback=%2Enpp_alina*5mills%2F62%2F2a7%2F133&trk=fulpro_grplogo""}, {""name""=>""Certified Translator Professional"", ""link""=>""http://www.linkedin.comhttp://www.linkedin.com/groups?gid=6609710&goback=%2Enpp_alina*5mills%2F62%2F2a7%2F133&trk=fulpro_grplogo""}]","[{""name""=>""Sumy State University"", ""description""=>""MA, Foreign Languages and Literatures, General"", ""period""=>""2004 – 2009""}, {""name""=>""Mott Community College"", ""description""=>"""", ""period""=>""""}]",[],http://www.linkedin.com/pub/alina-mills/62/2a7/133,,No,2015-05-17 11:27:29 -0700,"[{""name""=>""Max Argunov"", ""url""=>""https://www.linkedin.com/pub/max-argunov/61/882/767?trk=pub-pbmap""}, {""name""=>""Kseniya Medvedeva"", ""url""=>""https://www.linkedin.com/pub/kseniya-medvedeva/5a/51a/3b4?trk=pub-pbmap""}, {""name""=>""Galyna Sturm"", ""url""=>""https://www.linkedin.com/pub/galyna-sturm/7/805/97?trk=pub-pbmap""}, {""name""=>""Daria Shyman"", ""url""=>""https://www.linkedin.com/pub/daria-shyman/76/383/893?trk=pub-pbmap""}, {""name""=>""Anna Prokopenko"", ""url""=>""https://www.linkedin.com/pub/anna-prokopenko/8a/b25/501?trk=pub-pbmap""}, {""name""=>""Nadia Tratch"", ""url""=>""https://www.linkedin.com/pub/nadia-tratch/24/971/130?trk=pub-pbmap""}, {""name""=>""Yulia Girina"", ""url""=>""https://www.linkedin.com/pub/yulia-girina/54/80/169?trk=pub-pbmap""}, {""name""=>""Eugenia Belonogova"", ""url""=>""https://www.linkedin.com/pub/eugenia-belonogova/1/427/394?trk=pub-pbmap""}, {""name""=>""Oleg Sylvestrov"", ""url""=>""https://www.linkedin.com/pub/oleg-sylvestrov/17/249/29b?trk=pub-pbmap""}, {""name""=>""Artyom Fomenko"", ""url""=>""https://www.linkedin.com/pub/artyom-fomenko/42/120/915?trk=pub-pbmap""}]",0,public/uploads/pictures/1c9611c.jpg,"Russian content writer, translator and proofreader for gambling website.",0
