title,company,description,start_date,end_date,linkedin_company_url,skills,certifications,languages,name,location,area,industry,picture,organizations,groups,education,websites,profile_url,summary,current,timestamp,related_people,degree,pic_path,score
Production Designer/Rental Manager,Technical Theatre Services- Signature Events,,2011-01-01,2015-05-18,http://www.linkedin.com/,"[""Event Management"", ""Event Planning"", ""Video Production"", ""Theatre"", ""Entertainment""]",[],[],Christopher Huntoon,Greater Chicago Area,Greater Chicago Area,Entertainment,https://static.licdn.com/scds/common/u/images/themes/katy/ghosts/person/ghost_person_150x150_v1.png,[],[],[],[],http://www.linkedin.com/pub/christopher-huntoon/36/1a5/758,,Yes,2015-05-17 23:47:14 -0700,"[{""name""=>""Charles Fowler"", ""url""=>""https://www.linkedin.com/pub/charles-fowler/70/4b/a63?trk=pub-pbmap""}, {""name""=>""Joe Cinquegrani"", ""url""=>""https://www.linkedin.com/pub/joe-cinquegrani/84/b41/563?trk=pub-pbmap""}, {""name""=>""Darcy Lawson"", ""url""=>""https://www.linkedin.com/pub/darcy-lawson/a/562/785?trk=pub-pbmap""}, {""name""=>""Yu-Luen Ma"", ""url""=>""https://www.linkedin.com/pub/yu-luen-ma/54/aaa/34b?trk=pub-pbmap""}, {""name""=>""Jennifer Ratkovic"", ""url""=>""https://www.linkedin.com/pub/jennifer-ratkovic/24/b/269?trk=pub-pbmap""}, {""name""=>""David Keller"", ""url""=>""https://www.linkedin.com/pub/david-keller/6/75/b17?trk=pub-pbmap""}, {""name""=>""Michael Ehlers"", ""url""=>""https://www.linkedin.com/pub/michael-ehlers/87/648/208?trk=pub-pbmap""}, {""name""=>""Emil Smajkan"", ""url""=>""https://www.linkedin.com/pub/emil-smajkan/44/320/758?trk=pub-pbmap""}, {""name""=>""tom Keane"", ""url""=>""https://www.linkedin.com/pub/tom-keane/1/261/665?trk=pub-pbmap""}]",0,public/uploads/pictures/ghost_person_150x150_v1.png,0
Director of Basketball Operations/Part Owner,Denali Basketball Academy,,2014-06-01,,http://www.linkedin.com/,"[""Sports Management"", ""Sports"", ""Sports Marketing"", ""Sports Coaching"", ""Scouting"", ""Athletic Training"", ""Basketball"", ""Public Speaking"", ""Strength Training"", ""Basketball Coaching"", ""Strength"", ""Player Development"", ""Fitness"", ""Fundraising"", ""Personal Training"", ""Fitness Training"", ""PowerPoint"", ""Sports Psychology"", ""Microsoft Office"", ""Microsoft Word"", ""Physical Education"", ""Staff Development"", ""Student Development"", ""Athletics"", ""Coaching""]",[],[],Julian Williams,Glenview,Illinois,Sports,https://static.licdn.com/scds/common/u/images/themes/katy/ghosts/person/ghost_person_150x150_v1.png,[],"[{""name""=>""University of Wisconsin-Whitewater Track and Field Alumni"", ""link""=>""http://www.linkedin.comhttp://www.linkedin.com/groups?gid=2922630&goback=%2Enpp_julian*5williams%2F66%2F39%2Fb&trk=fulpro_grplogo""}, {""name""=>""The Business of Basketball"", ""link""=>""http://www.linkedin.comhttp://www.linkedin.com/groups?gid=3810625&goback=%2Enpp_julian*5williams%2F66%2F39%2Fb&trk=fulpro_grplogo""}, {""name""=>""Sports Industry Network"", ""link""=>""http://www.linkedin.comhttp://www.linkedin.com/groups?gid=73802&goback=%2Enpp_julian*5williams%2F66%2F39%2Fb&trk=fulpro_grplogo""}, {""name""=>""Concordia University Chicago [CUC]"", ""link""=>""http://www.linkedin.comhttp://www.linkedin.com/groups?gid=1830840&goback=%2Enpp_julian*5williams%2F66%2F39%2Fb&trk=fulpro_grplogo""}, {""name""=>""University of Wisconsin - Whitewater Sales Alumni and Enthusiasts"", ""link""=>""http://www.linkedin.comhttp://www.linkedin.com/groups?gid=3690616&goback=%2Enpp_julian*5williams%2F66%2F39%2Fb&trk=fulpro_grplogo""}, {""name""=>""Basketball Coaches - HoopCoach.org"", ""link""=>""http://www.linkedin.comhttp://www.linkedin.com/groups?gid=1935088&goback=%2Enpp_julian*5williams%2F66%2F39%2Fb&trk=fulpro_grplogo""}, {""name""=>""Australian Basketball Network"", ""link""=>""http://www.linkedin.comhttp://www.linkedin.com/groups?gid=4227602&goback=%2Enpp_julian*5williams%2F66%2F39%2Fb&trk=fulpro_grplogo""}, {""name""=>""Athleadership Career Network"", ""link""=>""http://www.linkedin.comhttp://www.linkedin.com/groups?gid=4685014&goback=%2Enpp_julian*5williams%2F66%2F39%2Fb&trk=fulpro_grplogo""}, {""name""=>""Alumni of Concordia University Chicago"", ""link""=>""http://www.linkedin.comhttp://www.linkedin.com/groups?gid=112292&goback=%2Enpp_julian*5williams%2F66%2F39%2Fb&trk=fulpro_grplogo""}, {""name""=>""UW-Whitewater Alumni"", ""link""=>""http://www.linkedin.comhttp://www.linkedin.com/groups?gid=138815&goback=%2Enpp_julian*5williams%2F66%2F39%2Fb&trk=fulpro_grplogo""}]","[{""name""=>""Northeastern Illinois University"", ""description""=>""Economics, Business/Managerial Economics"", ""period""=>""2012 – 2015""}, {""name""=>""Concordia University Chicago"", ""description""=>""Transfer, Business/Commerce, General"", ""period""=>""2011 – 2012""}, {""name""=>""University of Wisconsin-Whitewater"", ""description""=>""Transfer, Business/Commerce, General"", ""period""=>""2010 – 2011""}]","[""http://denalibasketball.com""]",http://www.linkedin.com/pub/julian-williams/66/39/b,"Collegiately competed at the University of Wisconsin Whitewater as well as Concordia University now am completing my degree in business/economics at Northeastern Illinois University. I have a passion for the game of basketball and have coached AAU, Travel, and Feeder Teams for the past four years now. Inspiring others to commit to long-term goals physically and academically to prepare them with the necessary tools to succeed in other aspects of life, not just basketball. Compassionate about teaching basketball, as a one-time player and now current coach, stressing the importance of healthy physical and mental habits is key. With a great deal of experience coaching, the awareness of each athlete’s different personality is key, and being seasoned to meet each athletes’ needs mentally and physically as players is crucial to success. One holds an impressive track record of handling and coordinating daily practice schedules, assisting in player skill development, analyzing game film, season game schedules, and conducting community service work.",Yes,2015-05-17 23:54:23 -0700,"[{""name""=>""Joan West-Dacres"", ""url""=>""https://www.linkedin.com/pub/joan-west-dacres/7a/57b/89?trk=pub-pbmap""}, {""name""=>""Eureka Ross"", ""url""=>""https://www.linkedin.com/pub/eureka-ross/67/533/970?trk=pub-pbmap""}, {""name""=>""Salome Tsereteli-Stephens"", ""url""=>""https://www.linkedin.com/pub/salome-tsereteli-stephens/13/53a/459?trk=pub-pbmap""}, {""name""=>""Brett Winer"", ""url""=>""https://www.linkedin.com/pub/brett-winer/46/426/196?trk=pub-pbmap""}, {""name""=>""Robert Weis"", ""url""=>""https://www.linkedin.com/pub/robert-weis/6b/67a/1ab?trk=pub-pbmap""}, {""name""=>""Janet Grimes"", ""url""=>""https://www.linkedin.com/pub/janet-grimes/1b/67a/a18?trk=pub-pbmap""}, {""name""=>""Nicole Spizzirri"", ""url""=>""https://www.linkedin.com/pub/nicole-spizzirri/15/57/508?trk=pub-pbmap""}, {""name""=>""Tim Basadur"", ""url""=>""https://www.linkedin.com/pub/tim-basadur/8/11b/40?trk=pub-pbmap""}, {""name""=>""Jim Crowder"", ""url""=>""https://www.linkedin.com/pub/jim-crowder/5/208/7a0?trk=pub-pbmap""}, {""name""=>""Andrew Pollom"", ""url""=>""https://www.linkedin.com/pub/andrew-pollom/b/382/985?trk=pub-pbmap""}]",0,public/uploads/pictures/ghost_person_150x150_v1.png,0
Varsity Boy's Basketball Coach,William Howard Taft High School,,2014-04-01,2015-05-18,http://www.linkedin.com/,"[""Sports Management"", ""Sports"", ""Sports Marketing"", ""Sports Coaching"", ""Scouting"", ""Athletic Training"", ""Basketball"", ""Public Speaking"", ""Strength Training"", ""Basketball Coaching"", ""Strength"", ""Player Development"", ""Fitness"", ""Fundraising"", ""Personal Training"", ""Fitness Training"", ""PowerPoint"", ""Sports Psychology"", ""Microsoft Office"", ""Microsoft Word"", ""Physical Education"", ""Staff Development"", ""Student Development"", ""Athletics"", ""Coaching""]",[],[],Julian Williams,Glenview,Illinois,Sports,https://static.licdn.com/scds/common/u/images/themes/katy/ghosts/person/ghost_person_150x150_v1.png,[],"[{""name""=>""University of Wisconsin-Whitewater Track and Field Alumni"", ""link""=>""http://www.linkedin.comhttp://www.linkedin.com/groups?gid=2922630&goback=%2Enpp_julian*5williams%2F66%2F39%2Fb&trk=fulpro_grplogo""}, {""name""=>""The Business of Basketball"", ""link""=>""http://www.linkedin.comhttp://www.linkedin.com/groups?gid=3810625&goback=%2Enpp_julian*5williams%2F66%2F39%2Fb&trk=fulpro_grplogo""}, {""name""=>""Sports Industry Network"", ""link""=>""http://www.linkedin.comhttp://www.linkedin.com/groups?gid=73802&goback=%2Enpp_julian*5williams%2F66%2F39%2Fb&trk=fulpro_grplogo""}, {""name""=>""Concordia University Chicago [CUC]"", ""link""=>""http://www.linkedin.comhttp://www.linkedin.com/groups?gid=1830840&goback=%2Enpp_julian*5williams%2F66%2F39%2Fb&trk=fulpro_grplogo""}, {""name""=>""University of Wisconsin - Whitewater Sales Alumni and Enthusiasts"", ""link""=>""http://www.linkedin.comhttp://www.linkedin.com/groups?gid=3690616&goback=%2Enpp_julian*5williams%2F66%2F39%2Fb&trk=fulpro_grplogo""}, {""name""=>""Basketball Coaches - HoopCoach.org"", ""link""=>""http://www.linkedin.comhttp://www.linkedin.com/groups?gid=1935088&goback=%2Enpp_julian*5williams%2F66%2F39%2Fb&trk=fulpro_grplogo""}, {""name""=>""Australian Basketball Network"", ""link""=>""http://www.linkedin.comhttp://www.linkedin.com/groups?gid=4227602&goback=%2Enpp_julian*5williams%2F66%2F39%2Fb&trk=fulpro_grplogo""}, {""name""=>""Athleadership Career Network"", ""link""=>""http://www.linkedin.comhttp://www.linkedin.com/groups?gid=4685014&goback=%2Enpp_julian*5williams%2F66%2F39%2Fb&trk=fulpro_grplogo""}, {""name""=>""Alumni of Concordia University Chicago"", ""link""=>""http://www.linkedin.comhttp://www.linkedin.com/groups?gid=112292&goback=%2Enpp_julian*5williams%2F66%2F39%2Fb&trk=fulpro_grplogo""}, {""name""=>""UW-Whitewater Alumni"", ""link""=>""http://www.linkedin.comhttp://www.linkedin.com/groups?gid=138815&goback=%2Enpp_julian*5williams%2F66%2F39%2Fb&trk=fulpro_grplogo""}]","[{""name""=>""Northeastern Illinois University"", ""description""=>""Economics, Business/Managerial Economics"", ""period""=>""2012 – 2015""}, {""name""=>""Concordia University Chicago"", ""description""=>""Transfer, Business/Commerce, General"", ""period""=>""2011 – 2012""}, {""name""=>""University of Wisconsin-Whitewater"", ""description""=>""Transfer, Business/Commerce, General"", ""period""=>""2010 – 2011""}]","[""http://denalibasketball.com""]",http://www.linkedin.com/pub/julian-williams/66/39/b,"Collegiately competed at the University of Wisconsin Whitewater as well as Concordia University now am completing my degree in business/economics at Northeastern Illinois University. I have a passion for the game of basketball and have coached AAU, Travel, and Feeder Teams for the past four years now. Inspiring others to commit to long-term goals physically and academically to prepare them with the necessary tools to succeed in other aspects of life, not just basketball. Compassionate about teaching basketball, as a one-time player and now current coach, stressing the importance of healthy physical and mental habits is key. With a great deal of experience coaching, the awareness of each athlete’s different personality is key, and being seasoned to meet each athletes’ needs mentally and physically as players is crucial to success. One holds an impressive track record of handling and coordinating daily practice schedules, assisting in player skill development, analyzing game film, season game schedules, and conducting community service work.",Yes,2015-05-17 23:54:23 -0700,"[{""name""=>""Joan West-Dacres"", ""url""=>""https://www.linkedin.com/pub/joan-west-dacres/7a/57b/89?trk=pub-pbmap""}, {""name""=>""Eureka Ross"", ""url""=>""https://www.linkedin.com/pub/eureka-ross/67/533/970?trk=pub-pbmap""}, {""name""=>""Salome Tsereteli-Stephens"", ""url""=>""https://www.linkedin.com/pub/salome-tsereteli-stephens/13/53a/459?trk=pub-pbmap""}, {""name""=>""Brett Winer"", ""url""=>""https://www.linkedin.com/pub/brett-winer/46/426/196?trk=pub-pbmap""}, {""name""=>""Robert Weis"", ""url""=>""https://www.linkedin.com/pub/robert-weis/6b/67a/1ab?trk=pub-pbmap""}, {""name""=>""Janet Grimes"", ""url""=>""https://www.linkedin.com/pub/janet-grimes/1b/67a/a18?trk=pub-pbmap""}, {""name""=>""Nicole Spizzirri"", ""url""=>""https://www.linkedin.com/pub/nicole-spizzirri/15/57/508?trk=pub-pbmap""}, {""name""=>""Tim Basadur"", ""url""=>""https://www.linkedin.com/pub/tim-basadur/8/11b/40?trk=pub-pbmap""}, {""name""=>""Jim Crowder"", ""url""=>""https://www.linkedin.com/pub/jim-crowder/5/208/7a0?trk=pub-pbmap""}, {""name""=>""Andrew Pollom"", ""url""=>""https://www.linkedin.com/pub/andrew-pollom/b/382/985?trk=pub-pbmap""}]",0,public/uploads/pictures/ghost_person_150x150_v1.png,0
Computer Network Defense Planner,Naval Cyber Defense Operations Command,"Lead and coordinate NCDOC planning efforts for all applicable OPLANs, CONOPs, OPORDs, PLANORDs, WARNORDs, FRAGOs, OPTASKs, command operational initiatives, and other documents as assigned. Collaborate with NCDOC personnel and external components, services, and agency planners in support of planning efforts. Transition executable orders and tasks into Current Operations for execution as required. Certified Network +",2012-01-01,2015-05-18,http://www.linkedin.com/,"[""Military"", ""Command"", ""Navy"", ""Program Management"", ""Security"", ""C4ISR"", ""Policy"", ""Team Leadership"", ""Project Planning"", ""Management"", ""Analysis"", ""Strategic Planning""]",[],[],Brian Harris,Norfolk,Virginia Area,Defense & Space,https://static.licdn.com/scds/common/u/images/themes/katy/ghosts/person/ghost_person_150x150_v1.png,[],[],"[{""name""=>""University of Phoenix"", ""description""=>"""", ""period""=>""2012 – 2013""}, {""name""=>""Ashworth University"", ""description""=>"""", ""period""=>""2006 – 2008""}]",[],http://www.linkedin.com/pub/brian-harris/a/1b4/236,,Yes,2015-05-17 23:54:56 -0700,"[{""name""=>""Eric Nelle"", ""url""=>""https://www.linkedin.com/pub/eric-nelle/83/706/831?trk=pub-pbmap""}, {""name""=>""John Kelley"", ""url""=>""https://www.linkedin.com/pub/john-kelley/2/719/166?trk=pub-pbmap""}, {""name""=>""Jessica Madson"", ""url""=>""https://www.linkedin.com/pub/jessica-madson/a5/688/7?trk=pub-pbmap""}, {""name""=>""Rory Eveland"", ""url""=>""https://www.linkedin.com/pub/rory-eveland/92/34a/793?trk=pub-pbmap""}, {""name""=>""Chuck Littmann, CISSP"", ""url""=>""https://www.linkedin.com/pub/chuck-littmann-cissp/51/513/1b5?trk=pub-pbmap""}, {""name""=>""John Bos"", ""url""=>""https://www.linkedin.com/pub/john-bos/0/608/868?trk=pub-pbmap""}, {""name""=>""Thai Chau"", ""url""=>""https://www.linkedin.com/pub/thai-chau/12/732/329?trk=pub-pbmap""}, {""name""=>""James Dietle"", ""url""=>""https://www.linkedin.com/pub/james-dietle/85/837/b67?trk=pub-pbmap""}, {""name""=>""janet Anthony"", ""url""=>""https://www.linkedin.com/pub/janet-anthony/40/866/b70?trk=pub-pbmap""}]",0,public/uploads/pictures/ghost_person_150x150_v1.png,0
Strategic and Operational Information Operations Planner,Navy Information Operations Command - Norfolk,"Mr. Harris is an expert in Information Operations planning execution, policy and doctrine. He brings recent, relevant experience in all core competencies of Information Operations–Information Warfare (IO-IW) as well as Theater Security Cooperation, Intelligence collection, analysis and reporting of SIGINT (ELINT, COMINT) and National Reconnaissance Operations. He is a Certified Navy Instructor, Master Training Specialist and Certified Level 5 Navy IO Planner. Mr. Harris has over Twenty-six years experience in C4ISR, technical intelligence, operations management; including analysis and reporting, combat systems operations, and program management. He has supported Theater Commanders with detailed strategic IO plans, JOPES and Integrated Joint Special Technical Operations (IJSTO). He has relevant recent experience with doctrine, policy and the approval authorities which correspond to the complex methodologies involved with the employment of kinetic and non-kinetic applications. A recognized expert in strategic and operational planning, information operations, and communication strategy; he led numerous operational efforts, and personally authored the commander’s objectives, effects and tasks for operations in the AFRICOM, CENTCOM, PACOM and SOUTHCOM areas of responsibility. Command Civilian of the Year (COY) 2008, as Strategic Information Operations (IO) Planner for the development of real world, exercise and experimental joint IO plans supporting Theater commanders including in depth analysis of Political, Military, Economic, Social, Infrastructure, & Information (PMESII).",2005-02-01,2012-06-07,http://www.linkedin.com/,"[""Military"", ""Command"", ""Navy"", ""Program Management"", ""Security"", ""C4ISR"", ""Policy"", ""Team Leadership"", ""Project Planning"", ""Management"", ""Analysis"", ""Strategic Planning""]",[],[],Brian Harris,Norfolk,Virginia Area,Defense & Space,https://static.licdn.com/scds/common/u/images/themes/katy/ghosts/person/ghost_person_150x150_v1.png,[],[],"[{""name""=>""University of Phoenix"", ""description""=>"""", ""period""=>""2012 – 2013""}, {""name""=>""Ashworth University"", ""description""=>"""", ""period""=>""2006 – 2008""}]",[],http://www.linkedin.com/pub/brian-harris/a/1b4/236,,No,2015-05-17 23:54:56 -0700,"[{""name""=>""Eric Nelle"", ""url""=>""https://www.linkedin.com/pub/eric-nelle/83/706/831?trk=pub-pbmap""}, {""name""=>""John Kelley"", ""url""=>""https://www.linkedin.com/pub/john-kelley/2/719/166?trk=pub-pbmap""}, {""name""=>""Jessica Madson"", ""url""=>""https://www.linkedin.com/pub/jessica-madson/a5/688/7?trk=pub-pbmap""}, {""name""=>""Rory Eveland"", ""url""=>""https://www.linkedin.com/pub/rory-eveland/92/34a/793?trk=pub-pbmap""}, {""name""=>""Chuck Littmann, CISSP"", ""url""=>""https://www.linkedin.com/pub/chuck-littmann-cissp/51/513/1b5?trk=pub-pbmap""}, {""name""=>""John Bos"", ""url""=>""https://www.linkedin.com/pub/john-bos/0/608/868?trk=pub-pbmap""}, {""name""=>""Thai Chau"", ""url""=>""https://www.linkedin.com/pub/thai-chau/12/732/329?trk=pub-pbmap""}, {""name""=>""James Dietle"", ""url""=>""https://www.linkedin.com/pub/james-dietle/85/837/b67?trk=pub-pbmap""}, {""name""=>""janet Anthony"", ""url""=>""https://www.linkedin.com/pub/janet-anthony/40/866/b70?trk=pub-pbmap""}]",0,public/uploads/pictures/ghost_person_150x150_v1.png,0
FLEET TRAINING DEPARTMENT HEAD,NAVAL SECURITY GROUP ACTIVITY NORFOLK,"Led cryptologic and Information Operation (IO) training, command, fleet and Joint assets through 22 formal courses of instruction at the Cryptologic Readiness Group. As Fleet Training Department Head, he directed oversight and management of 38 U.S. Navy and Canadian Instructors providing state of the art waterfront training strategy for cryptologic and Information Warfare (IW) support to fleet operations. Incorporated live training environments with emphasis on team leadership, which yielded the Cryptologic Stimulator Exercise (CSE). Performed ELINT collection to build safe for flight corridor; mitigating SAM threats to coalition aircraft, facilitating “feet dry” sorties supporting all warfare missions. This corridor, still in use today, significantly increased the overall effectiveness of National Reconnaissance Operations. Researched and developed more than 100 ELINT technical working aids for theater operations. Generated effective daily, weekly, and monthly SIGINT coverage and collection management plans throughout an extended deployment for the Harry S. Truman Battle Group. Direct Support Program Manager for over 350 Atlantic Fleet officer and enlisted personnel and the associated deployable equipment augmentation to cryptologic capable ships and aircraft in support of 14 joint operations. Responsible for the validation, endorsement and tasking of Atlantic Fleets Tactical Crypotologic Support (TCS) personnel in support of Navy Special Warfare requirements. Expertly planned and executed a budget in excess of $250K.",2002-02-01,2004-02-02,http://www.linkedin.com/,"[""Military"", ""Command"", ""Navy"", ""Program Management"", ""Security"", ""C4ISR"", ""Policy"", ""Team Leadership"", ""Project Planning"", ""Management"", ""Analysis"", ""Strategic Planning""]",[],[],Brian Harris,Norfolk,Virginia Area,Defense & Space,https://static.licdn.com/scds/common/u/images/themes/katy/ghosts/person/ghost_person_150x150_v1.png,[],[],"[{""name""=>""University of Phoenix"", ""description""=>"""", ""period""=>""2012 – 2013""}, {""name""=>""Ashworth University"", ""description""=>"""", ""period""=>""2006 – 2008""}]",[],http://www.linkedin.com/pub/brian-harris/a/1b4/236,,No,2015-05-17 23:54:56 -0700,"[{""name""=>""Eric Nelle"", ""url""=>""https://www.linkedin.com/pub/eric-nelle/83/706/831?trk=pub-pbmap""}, {""name""=>""John Kelley"", ""url""=>""https://www.linkedin.com/pub/john-kelley/2/719/166?trk=pub-pbmap""}, {""name""=>""Jessica Madson"", ""url""=>""https://www.linkedin.com/pub/jessica-madson/a5/688/7?trk=pub-pbmap""}, {""name""=>""Rory Eveland"", ""url""=>""https://www.linkedin.com/pub/rory-eveland/92/34a/793?trk=pub-pbmap""}, {""name""=>""Chuck Littmann, CISSP"", ""url""=>""https://www.linkedin.com/pub/chuck-littmann-cissp/51/513/1b5?trk=pub-pbmap""}, {""name""=>""John Bos"", ""url""=>""https://www.linkedin.com/pub/john-bos/0/608/868?trk=pub-pbmap""}, {""name""=>""Thai Chau"", ""url""=>""https://www.linkedin.com/pub/thai-chau/12/732/329?trk=pub-pbmap""}, {""name""=>""James Dietle"", ""url""=>""https://www.linkedin.com/pub/james-dietle/85/837/b67?trk=pub-pbmap""}, {""name""=>""janet Anthony"", ""url""=>""https://www.linkedin.com/pub/janet-anthony/40/866/b70?trk=pub-pbmap""}]",0,public/uploads/pictures/ghost_person_150x150_v1.png,0
Commanding Officer,CID Unit Monterey,,2014-09-01,2015-05-18,http://www.linkedin.com/,"[""SIGINT"", ""Military Operations"", ""Navy"", ""Security Clearance"", ""Electronic Warfare"", ""National Security"", ""Command"", ""Military"", ""C4ISR"", ""DoD"", ""Intelligence Analysis"", ""Information Assurance"", ""Intelligence"", ""Operational Planning"", ""Force Protection"", ""Government"", ""Counterterrorism"", ""Top Secret"", ""Cyber Warfare""]",[],[],Chris Slattery,Monterey,California,Military,https://static.licdn.com/scds/common/u/images/themes/katy/ghosts/person/ghost_person_150x150_v1.png,[],"[{""name""=>""US Navy Information Dominance Warfare Officers"", ""link""=>""http://www.linkedin.comhttp://www.linkedin.com/groups?gid=2873945&goback=%2Enpp_chris*5slattery%2F14%2Fba2%2F116&trk=fulpro_grplogo""}]","[{""name""=>""Naval Postgraduate School"", ""description""=>"""", ""period""=>""1999 – 2001""}, {""name""=>""United States Naval Academy"", ""description""=>"""", ""period""=>""1990 – 1994""}]",[],http://www.linkedin.com/pub/chris-slattery/14/ba2/116,,Yes,2015-05-17 23:55:53 -0700,"[{""name""=>""Rod Burley"", ""url""=>""https://www.linkedin.com/pub/rod-burley/7/ab3/803?trk=pub-pbmap""}, {""name""=>""Patrick Mallory"", ""url""=>""https://www.linkedin.com/pub/patrick-mallory/10/62/ab7?trk=pub-pbmap""}, {""name""=>""Jose Berrios"", ""url""=>""https://www.linkedin.com/pub/jose-berrios/7/729/524?trk=pub-pbmap""}, {""name""=>""Tracy Emmersen"", ""url""=>""https://www.linkedin.com/pub/tracy-emmersen/94/6b0/ba?trk=pub-pbmap""}, {""name""=>""Geraldine Cabanilla"", ""url""=>""https://www.linkedin.com/pub/geraldine-cabanilla/b5/903/727?trk=pub-pbmap""}, {""name""=>""Shelby Courtney"", ""url""=>""https://www.linkedin.com/pub/shelby-courtney/8b/16b/b09?trk=pub-pbmap""}, {""name""=>""James Hagy"", ""url""=>""https://www.linkedin.com/pub/james-hagy/14/ba5/550?trk=pub-pbmap""}, {""name""=>""Jamie Blake"", ""url""=>""https://www.linkedin.com/pub/jamie-blake/95/9ba/296?trk=pub-pbmap""}, {""name""=>""John Markley"", ""url""=>""https://www.linkedin.com/pub/john-markley/1a/b28/a1?trk=pub-pbmap""}, {""name""=>""Shelby Courtney"", ""url""=>""https://www.linkedin.com/pub/shelby-courtney/10/2b6/164?trk=pub-pbmap""}]",0,public/uploads/pictures/ghost_person_150x150_v1.png,0
