title,company,description,start_date,end_date,linkedin_company_url,skills,certifications,languages,name,location,area,industry,picture,organizations,groups,education,websites,profile_url,summary,current,timestamp,related_people,degree,pic_path,score
Advance Senior SIGINT Analystt,7th Special Forces Group,"2011-2013 Advance Collection Team, U.S Army 7th Special Forces Group (A), EGLIN AFB, FL Served as a Senior Signals Intelligence/Electronic Warfare (SIGINT/EW) Cryptologic Linguist and collection equipment operator in the Technical Control and Analysis Element (TCAE) for the 7th Special Forces Group (Airborne) operating in the CENTCOM and SOUTHCOM Areas of Operations; Assists with technical, analytical and linguistic support for 7th Special Forces Group (Airborne) primary areas of operations. - Provided numerous training with peers to ensure they were trained proficiently in tactical ground equipment; UHF/HF/VHF/Wolfhound System/PRD-13 System/DRT1500 box. - Trained with TICOM Geometrics on GEONET software while still in its testing phase and development. - Trained and became qualified on Counter Electronic Warfare Systems during a three week Electronic Warfare Maintainer course.",2011-10-01,2014-01-02,http://www.linkedin.com/,"[""Wolfhound System,..."", ""Survey Tools, Data Base..."", ""Security Clearance"", ""Intelligence"", ""National Security"", ""Army"", ""Force Protection"", ""SIGINT"", ""Afghanistan"", ""Reconnaissance"", ""Electronic Warfare"", ""Signals Intelligence"", ""Security"", ""Combat"", ""Training"", ""Analysis"", ""Telecommunications"", ""Intelligence Analysis"", ""Briefing"", ""Strategic Planning"", ""Military Operations"", ""DoD"", ""Strategy"", ""Military"", ""Counterinsurgency"", ""HUMINT"", ""Human Resources"", ""Leadership"", ""Tactics"", ""Defense"", ""Counterintelligence"", ""Intelligence Community"", ""Command"", ""Testing"", ""Homeland Security"", ""Operational Planning"", ""Interagency Coordination"", ""IED"", ""Weapons"", ""Counterterrorism"", ""Military Experience"", ""SCI Clearance"", ""Special Operations"", ""Top Secret"", ""Information Assurance"", ""Military Training"", ""Security Operations"", ""Physical Security""]",[],"[{""language""=>""English"", ""proficiency""=>""Native or bilingual proficiency""}, {""language""=>""Spanish"", ""proficiency""=>""Native or bilingual proficiency""}]",HERIBERTO RUIZ,Crestview,Florida,Military,https://media.licdn.com/mpr/mpr/shrinknp_400_400/p/1/000/215/077/0d3dff7.jpg,[],"[{""name""=>""\""H2020 SECURITY Research\"" Defense R&D Projects, Emergency, Intelligence, GEOINT"", ""link""=>""http://www.linkedin.comhttp://www.linkedin.com/groups?gid=4427002&goback=%2Enpp_heriberto*5ruiz%2F64%2F344%2F7ab&trk=fulpro_grplogo""}, {""name""=>""Ranger Tabbers"", ""link""=>""http://www.linkedin.comhttp://www.linkedin.com/groups?gid=2104504&goback=%2Enpp_heriberto*5ruiz%2F64%2F344%2F7ab&trk=fulpro_grplogo""}, {""name""=>""75th Ranger Regiment (2104513)"", ""link""=>""http://www.linkedin.comhttp://www.linkedin.com/groups?gid=2104513&goback=%2Enpp_heriberto*5ruiz%2F64%2F344%2F7ab&trk=fulpro_grplogo""}, {""name""=>""\"" HORIZON 2020 \"" Framework Programme for Research & Innovation [Official Group]"", ""link""=>""http://www.linkedin.comhttp://www.linkedin.com/groups?gid=3731775&goback=%2Enpp_heriberto*5ruiz%2F64%2F344%2F7ab&trk=fulpro_grplogo""}, {""name""=>""C4I / SIGINT / Radio Communication"", ""link""=>""http://www.linkedin.comhttp://www.linkedin.com/groups?gid=3086360&goback=%2Enpp_heriberto*5ruiz%2F64%2F344%2F7ab&trk=fulpro_grplogo""}, {""name""=>""3/75 Ranger Battalion"", ""link""=>""http://www.linkedin.comhttp://www.linkedin.com/groups?gid=162299&goback=%2Enpp_heriberto*5ruiz%2F64%2F344%2F7ab&trk=fulpro_grplogo""}, {""name""=>""US Army Rangers"", ""link""=>""http://www.linkedin.comhttp://www.linkedin.com/groups?gid=62021&goback=%2Enpp_heriberto*5ruiz%2F64%2F344%2F7ab&trk=fulpro_grplogo""}, {""name""=>""USARA; US Army Ranger Association"", ""link""=>""http://www.linkedin.comhttp://www.linkedin.com/groups?gid=1810200&goback=%2Enpp_heriberto*5ruiz%2F64%2F344%2F7ab&trk=fulpro_grplogo""}, {""name""=>""3rd Ranger Battalion"", ""link""=>""http://www.linkedin.comhttp://www.linkedin.com/groups?gid=2104511&goback=%2Enpp_heriberto*5ruiz%2F64%2F344%2F7ab&trk=fulpro_grplogo""}, {""name""=>""5th Special Forces Group (A)"", ""link""=>""http://www.linkedin.comhttp://www.linkedin.com/groups?gid=3849622&goback=%2Enpp_heriberto*5ruiz%2F64%2F344%2F7ab&trk=fulpro_grplogo""}, {""name""=>""Best Ranger Competition Supporters"", ""link""=>""http://www.linkedin.comhttp://www.linkedin.com/groups?gid=1839759&goback=%2Enpp_heriberto*5ruiz%2F64%2F344%2F7ab&trk=fulpro_grplogo""}, {""name""=>""1/75 Ranger Battalion"", ""link""=>""http://www.linkedin.comhttp://www.linkedin.com/groups?gid=101771&goback=%2Enpp_heriberto*5ruiz%2F64%2F344%2F7ab&trk=fulpro_grplogo""}, {""name""=>""2nd Ranger Battalion"", ""link""=>""http://www.linkedin.comhttp://www.linkedin.com/groups?gid=2104508&goback=%2Enpp_heriberto*5ruiz%2F64%2F344%2F7ab&trk=fulpro_grplogo""}, {""name""=>""Ranger School"", ""link""=>""http://www.linkedin.comhttp://www.linkedin.com/groups?gid=55533&goback=%2Enpp_heriberto*5ruiz%2F64%2F344%2F7ab&trk=fulpro_grplogo""}]","[{""name""=>""Cochise College"", ""description""=>""Associate of Arts and Sciences (A.A.S.), Intelligence Operations"", ""period""=>""2010 – 2015""}, {""name""=>""Nwfsc"", ""description""=>""Associate of Arts and Sciences (AAS), Criminal Justice"", ""period""=>""2012 – 2014""}, {""name""=>""St. Philip's College San Antonio TX"", ""description""=>""64 Credit Hrs, Criminal Justice and Corrections"", ""period""=>""2008 – 2009""}, {""name""=>""Laguardia Community College"", ""description""=>"""", ""period""=>""2001 – 2003""}]",[],http://www.linkedin.com/pub/heriberto-ruiz/64/344/7ab,"Active Top Secret/ SCI clearance with HCS/Gamma Provided Through Single Scope Background Investigation (SSBI). I have completed 8 years SIGINT analyst performance in different Areas of Operations. Skilled Intelligence Analyst with Tactical/Strategic organizational, analytical, and training abilities. Provided SIGINT support to Coalition Force elements through 24-hour watch operations. Utilized numerous IC databases and tipping tools to yield a number of reports daily. Experience in OEF extends to; Low Level Voice Interception (LLVI), Signal Terminal Guidance (STG), numerous program and various SIGINT databases search engines and disciplines. Task Force 3-10 Geospatial analysis while assisting the Tactical Screening Facility, ISR support and Air coordinations, Task-Force 3-10 target development. SIGINT analysis stateside as well as leading elements while providing (STG) SIGINT terminal guidance/VHF ground guidance to overseas in a high stress environment. My first deployment, as a SIGINT Analyst, I was the training NCOIC for the foreign soldiers, late comers to the deployment and anyone who needed assistance fixing equipment, configuring databases/or tools, as well as report- writing / Mission tasking / de-tasking priorities, while supporting air assets during combat operations. I was awarded the Army Joint Service Commendation Medal for my work as a Senior SIGINT Analyst, specifically, for providing accurate information during Combat Operations and preventing attacks to Forces. Completed two rotations to Afghanistan (OEF) as a Senior-Level Ground SIGINT Analyst Operator, and Geospatial Analyst for target development in 2009 and 2010. Additionally, I participated in numerous Objectives providing SIGINT/EW support to Task-Force Commander capturing and neutralizing many OBJs while developing new target packages.",No,2015-05-17 23:33:06 -0700,"[{""name""=>""Angie Minestra"", ""url""=>""https://www.linkedin.com/pub/angie-minestra/61/aa2/568?trk=pub-pbmap""}, {""name""=>""Carrie Collins"", ""url""=>""https://www.linkedin.com/pub/carrie-collins/20/310/9b1?trk=pub-pbmap""}, {""name""=>""Karl Weekes"", ""url""=>""https://www.linkedin.com/pub/karl-weekes/16/60/468?trk=pub-pbmap""}, {""name""=>""Lindsey Moore Lappin"", ""url""=>""https://www.linkedin.com/pub/lindsey-moore-lappin/14/654/70a?trk=pub-pbmap""}, {""name""=>""niko rivera"", ""url""=>""https://www.linkedin.com/pub/niko-rivera/62/814/220?trk=pub-pbmap""}, {""name""=>""Sammy Jackson"", ""url""=>""https://www.linkedin.com/pub/sammy-jackson/68/352/367?trk=pub-pbmap""}, {""name""=>""Heather Taylor"", ""url""=>""https://www.linkedin.com/pub/heather-taylor/46/765/28a?trk=pub-pbmap""}, {""name""=>""Shauna Brock"", ""url""=>""https://www.linkedin.com/pub/shauna-brock/29/54/2a8?trk=pub-pbmap""}, {""name""=>""Thomas Humphrey"", ""url""=>""https://www.linkedin.com/pub/thomas-humphrey/54/2b2/a67?trk=pub-pbmap""}]",0,public/uploads/pictures/0d3dff7.jpg,0
Senior Intelligence Analyst,7th SFG(A) Eglin AFB,,2011-10-01,2014-01-02,http://www.linkedin.com/,"[""Wolfhound System,..."", ""Survey Tools, Data Base..."", ""Security Clearance"", ""Intelligence"", ""National Security"", ""Army"", ""Force Protection"", ""SIGINT"", ""Afghanistan"", ""Reconnaissance"", ""Electronic Warfare"", ""Signals Intelligence"", ""Security"", ""Combat"", ""Training"", ""Analysis"", ""Telecommunications"", ""Intelligence Analysis"", ""Briefing"", ""Strategic Planning"", ""Military Operations"", ""DoD"", ""Strategy"", ""Military"", ""Counterinsurgency"", ""HUMINT"", ""Human Resources"", ""Leadership"", ""Tactics"", ""Defense"", ""Counterintelligence"", ""Intelligence Community"", ""Command"", ""Testing"", ""Homeland Security"", ""Operational Planning"", ""Interagency Coordination"", ""IED"", ""Weapons"", ""Counterterrorism"", ""Military Experience"", ""SCI Clearance"", ""Special Operations"", ""Top Secret"", ""Information Assurance"", ""Military Training"", ""Security Operations"", ""Physical Security""]",[],"[{""language""=>""English"", ""proficiency""=>""Native or bilingual proficiency""}, {""language""=>""Spanish"", ""proficiency""=>""Native or bilingual proficiency""}]",HERIBERTO RUIZ,Crestview,Florida,Military,https://media.licdn.com/mpr/mpr/shrinknp_400_400/p/1/000/215/077/0d3dff7.jpg,[],"[{""name""=>""\""H2020 SECURITY Research\"" Defense R&D Projects, Emergency, Intelligence, GEOINT"", ""link""=>""http://www.linkedin.comhttp://www.linkedin.com/groups?gid=4427002&goback=%2Enpp_heriberto*5ruiz%2F64%2F344%2F7ab&trk=fulpro_grplogo""}, {""name""=>""Ranger Tabbers"", ""link""=>""http://www.linkedin.comhttp://www.linkedin.com/groups?gid=2104504&goback=%2Enpp_heriberto*5ruiz%2F64%2F344%2F7ab&trk=fulpro_grplogo""}, {""name""=>""75th Ranger Regiment (2104513)"", ""link""=>""http://www.linkedin.comhttp://www.linkedin.com/groups?gid=2104513&goback=%2Enpp_heriberto*5ruiz%2F64%2F344%2F7ab&trk=fulpro_grplogo""}, {""name""=>""\"" HORIZON 2020 \"" Framework Programme for Research & Innovation [Official Group]"", ""link""=>""http://www.linkedin.comhttp://www.linkedin.com/groups?gid=3731775&goback=%2Enpp_heriberto*5ruiz%2F64%2F344%2F7ab&trk=fulpro_grplogo""}, {""name""=>""C4I / SIGINT / Radio Communication"", ""link""=>""http://www.linkedin.comhttp://www.linkedin.com/groups?gid=3086360&goback=%2Enpp_heriberto*5ruiz%2F64%2F344%2F7ab&trk=fulpro_grplogo""}, {""name""=>""3/75 Ranger Battalion"", ""link""=>""http://www.linkedin.comhttp://www.linkedin.com/groups?gid=162299&goback=%2Enpp_heriberto*5ruiz%2F64%2F344%2F7ab&trk=fulpro_grplogo""}, {""name""=>""US Army Rangers"", ""link""=>""http://www.linkedin.comhttp://www.linkedin.com/groups?gid=62021&goback=%2Enpp_heriberto*5ruiz%2F64%2F344%2F7ab&trk=fulpro_grplogo""}, {""name""=>""USARA; US Army Ranger Association"", ""link""=>""http://www.linkedin.comhttp://www.linkedin.com/groups?gid=1810200&goback=%2Enpp_heriberto*5ruiz%2F64%2F344%2F7ab&trk=fulpro_grplogo""}, {""name""=>""3rd Ranger Battalion"", ""link""=>""http://www.linkedin.comhttp://www.linkedin.com/groups?gid=2104511&goback=%2Enpp_heriberto*5ruiz%2F64%2F344%2F7ab&trk=fulpro_grplogo""}, {""name""=>""5th Special Forces Group (A)"", ""link""=>""http://www.linkedin.comhttp://www.linkedin.com/groups?gid=3849622&goback=%2Enpp_heriberto*5ruiz%2F64%2F344%2F7ab&trk=fulpro_grplogo""}, {""name""=>""Best Ranger Competition Supporters"", ""link""=>""http://www.linkedin.comhttp://www.linkedin.com/groups?gid=1839759&goback=%2Enpp_heriberto*5ruiz%2F64%2F344%2F7ab&trk=fulpro_grplogo""}, {""name""=>""1/75 Ranger Battalion"", ""link""=>""http://www.linkedin.comhttp://www.linkedin.com/groups?gid=101771&goback=%2Enpp_heriberto*5ruiz%2F64%2F344%2F7ab&trk=fulpro_grplogo""}, {""name""=>""2nd Ranger Battalion"", ""link""=>""http://www.linkedin.comhttp://www.linkedin.com/groups?gid=2104508&goback=%2Enpp_heriberto*5ruiz%2F64%2F344%2F7ab&trk=fulpro_grplogo""}, {""name""=>""Ranger School"", ""link""=>""http://www.linkedin.comhttp://www.linkedin.com/groups?gid=55533&goback=%2Enpp_heriberto*5ruiz%2F64%2F344%2F7ab&trk=fulpro_grplogo""}]","[{""name""=>""Cochise College"", ""description""=>""Associate of Arts and Sciences (A.A.S.), Intelligence Operations"", ""period""=>""2010 – 2015""}, {""name""=>""Nwfsc"", ""description""=>""Associate of Arts and Sciences (AAS), Criminal Justice"", ""period""=>""2012 – 2014""}, {""name""=>""St. Philip's College San Antonio TX"", ""description""=>""64 Credit Hrs, Criminal Justice and Corrections"", ""period""=>""2008 – 2009""}, {""name""=>""Laguardia Community College"", ""description""=>"""", ""period""=>""2001 – 2003""}]",[],http://www.linkedin.com/pub/heriberto-ruiz/64/344/7ab,"Active Top Secret/ SCI clearance with HCS/Gamma Provided Through Single Scope Background Investigation (SSBI). I have completed 8 years SIGINT analyst performance in different Areas of Operations. Skilled Intelligence Analyst with Tactical/Strategic organizational, analytical, and training abilities. Provided SIGINT support to Coalition Force elements through 24-hour watch operations. Utilized numerous IC databases and tipping tools to yield a number of reports daily. Experience in OEF extends to; Low Level Voice Interception (LLVI), Signal Terminal Guidance (STG), numerous program and various SIGINT databases search engines and disciplines. Task Force 3-10 Geospatial analysis while assisting the Tactical Screening Facility, ISR support and Air coordinations, Task-Force 3-10 target development. SIGINT analysis stateside as well as leading elements while providing (STG) SIGINT terminal guidance/VHF ground guidance to overseas in a high stress environment. My first deployment, as a SIGINT Analyst, I was the training NCOIC for the foreign soldiers, late comers to the deployment and anyone who needed assistance fixing equipment, configuring databases/or tools, as well as report- writing / Mission tasking / de-tasking priorities, while supporting air assets during combat operations. I was awarded the Army Joint Service Commendation Medal for my work as a Senior SIGINT Analyst, specifically, for providing accurate information during Combat Operations and preventing attacks to Forces. Completed two rotations to Afghanistan (OEF) as a Senior-Level Ground SIGINT Analyst Operator, and Geospatial Analyst for target development in 2009 and 2010. Additionally, I participated in numerous Objectives providing SIGINT/EW support to Task-Force Commander capturing and neutralizing many OBJs while developing new target packages.",No,2015-05-17 23:33:06 -0700,"[{""name""=>""Angie Minestra"", ""url""=>""https://www.linkedin.com/pub/angie-minestra/61/aa2/568?trk=pub-pbmap""}, {""name""=>""Carrie Collins"", ""url""=>""https://www.linkedin.com/pub/carrie-collins/20/310/9b1?trk=pub-pbmap""}, {""name""=>""Karl Weekes"", ""url""=>""https://www.linkedin.com/pub/karl-weekes/16/60/468?trk=pub-pbmap""}, {""name""=>""Lindsey Moore Lappin"", ""url""=>""https://www.linkedin.com/pub/lindsey-moore-lappin/14/654/70a?trk=pub-pbmap""}, {""name""=>""niko rivera"", ""url""=>""https://www.linkedin.com/pub/niko-rivera/62/814/220?trk=pub-pbmap""}, {""name""=>""Sammy Jackson"", ""url""=>""https://www.linkedin.com/pub/sammy-jackson/68/352/367?trk=pub-pbmap""}, {""name""=>""Heather Taylor"", ""url""=>""https://www.linkedin.com/pub/heather-taylor/46/765/28a?trk=pub-pbmap""}, {""name""=>""Shauna Brock"", ""url""=>""https://www.linkedin.com/pub/shauna-brock/29/54/2a8?trk=pub-pbmap""}, {""name""=>""Thomas Humphrey"", ""url""=>""https://www.linkedin.com/pub/thomas-humphrey/54/2b2/a67?trk=pub-pbmap""}]",0,public/uploads/pictures/0d3dff7.jpg,0
Senior SIGINT Analyst (Linguist),"Senior Cryptologic Linguist, 75th Ranger Regiment, Ft Benning, GA","2009-2011 Senior Cryptologic Linguist, 75th Ranger Regiment, Ft Benning, GA Senior Cryptologic SIGINT Linguist for a globally deployable tactical Operational SIGINT Team (OST) which conducts Signals Intelligence (SIGINT) and Electronic Warfare (EW) operations in support of the 75th Ranger Regiment Special Troops Battalion and the three Ranger Line Battalions; responsible for exploitation and analysis of communication devices; which conducts SIGINT/EW and radio reconnaissance operations in denied, hostile, and politically sensitive areas; responsible for all linguistic duties for languages in Central and South America; responsible for operational training for the CENTCOM areas of Operations. - Received Army impact award for numerous Tactical combat Operation. - Produced numerous SIGINT reports in response to Request for information from Task Force personnel resulting in the detainment of numerous High Value Targets. - Led SIGINT Team in numerous tactical Objectives who... - Worked as the Geospatial SIGINT Analyst Exploitation NCOIC for a Tactical Screening Facility; CELLEX, DOCEX section. - Conducted Task Force SIGINT daily briefings, Analysis, Target Development, Tactical equipment training, and Mission Support during tactical deployment during Operation Enduring Freedom (OEF).",2009-06-01,2011-11-02,http://www.linkedin.com/,"[""Wolfhound System,..."", ""Survey Tools, Data Base..."", ""Security Clearance"", ""Intelligence"", ""National Security"", ""Army"", ""Force Protection"", ""SIGINT"", ""Afghanistan"", ""Reconnaissance"", ""Electronic Warfare"", ""Signals Intelligence"", ""Security"", ""Combat"", ""Training"", ""Analysis"", ""Telecommunications"", ""Intelligence Analysis"", ""Briefing"", ""Strategic Planning"", ""Military Operations"", ""DoD"", ""Strategy"", ""Military"", ""Counterinsurgency"", ""HUMINT"", ""Human Resources"", ""Leadership"", ""Tactics"", ""Defense"", ""Counterintelligence"", ""Intelligence Community"", ""Command"", ""Testing"", ""Homeland Security"", ""Operational Planning"", ""Interagency Coordination"", ""IED"", ""Weapons"", ""Counterterrorism"", ""Military Experience"", ""SCI Clearance"", ""Special Operations"", ""Top Secret"", ""Information Assurance"", ""Military Training"", ""Security Operations"", ""Physical Security""]",[],"[{""language""=>""English"", ""proficiency""=>""Native or bilingual proficiency""}, {""language""=>""Spanish"", ""proficiency""=>""Native or bilingual proficiency""}]",HERIBERTO RUIZ,Crestview,Florida,Military,https://media.licdn.com/mpr/mpr/shrinknp_400_400/p/1/000/215/077/0d3dff7.jpg,[],"[{""name""=>""\""H2020 SECURITY Research\"" Defense R&D Projects, Emergency, Intelligence, GEOINT"", ""link""=>""http://www.linkedin.comhttp://www.linkedin.com/groups?gid=4427002&goback=%2Enpp_heriberto*5ruiz%2F64%2F344%2F7ab&trk=fulpro_grplogo""}, {""name""=>""Ranger Tabbers"", ""link""=>""http://www.linkedin.comhttp://www.linkedin.com/groups?gid=2104504&goback=%2Enpp_heriberto*5ruiz%2F64%2F344%2F7ab&trk=fulpro_grplogo""}, {""name""=>""75th Ranger Regiment (2104513)"", ""link""=>""http://www.linkedin.comhttp://www.linkedin.com/groups?gid=2104513&goback=%2Enpp_heriberto*5ruiz%2F64%2F344%2F7ab&trk=fulpro_grplogo""}, {""name""=>""\"" HORIZON 2020 \"" Framework Programme for Research & Innovation [Official Group]"", ""link""=>""http://www.linkedin.comhttp://www.linkedin.com/groups?gid=3731775&goback=%2Enpp_heriberto*5ruiz%2F64%2F344%2F7ab&trk=fulpro_grplogo""}, {""name""=>""C4I / SIGINT / Radio Communication"", ""link""=>""http://www.linkedin.comhttp://www.linkedin.com/groups?gid=3086360&goback=%2Enpp_heriberto*5ruiz%2F64%2F344%2F7ab&trk=fulpro_grplogo""}, {""name""=>""3/75 Ranger Battalion"", ""link""=>""http://www.linkedin.comhttp://www.linkedin.com/groups?gid=162299&goback=%2Enpp_heriberto*5ruiz%2F64%2F344%2F7ab&trk=fulpro_grplogo""}, {""name""=>""US Army Rangers"", ""link""=>""http://www.linkedin.comhttp://www.linkedin.com/groups?gid=62021&goback=%2Enpp_heriberto*5ruiz%2F64%2F344%2F7ab&trk=fulpro_grplogo""}, {""name""=>""USARA; US Army Ranger Association"", ""link""=>""http://www.linkedin.comhttp://www.linkedin.com/groups?gid=1810200&goback=%2Enpp_heriberto*5ruiz%2F64%2F344%2F7ab&trk=fulpro_grplogo""}, {""name""=>""3rd Ranger Battalion"", ""link""=>""http://www.linkedin.comhttp://www.linkedin.com/groups?gid=2104511&goback=%2Enpp_heriberto*5ruiz%2F64%2F344%2F7ab&trk=fulpro_grplogo""}, {""name""=>""5th Special Forces Group (A)"", ""link""=>""http://www.linkedin.comhttp://www.linkedin.com/groups?gid=3849622&goback=%2Enpp_heriberto*5ruiz%2F64%2F344%2F7ab&trk=fulpro_grplogo""}, {""name""=>""Best Ranger Competition Supporters"", ""link""=>""http://www.linkedin.comhttp://www.linkedin.com/groups?gid=1839759&goback=%2Enpp_heriberto*5ruiz%2F64%2F344%2F7ab&trk=fulpro_grplogo""}, {""name""=>""1/75 Ranger Battalion"", ""link""=>""http://www.linkedin.comhttp://www.linkedin.com/groups?gid=101771&goback=%2Enpp_heriberto*5ruiz%2F64%2F344%2F7ab&trk=fulpro_grplogo""}, {""name""=>""2nd Ranger Battalion"", ""link""=>""http://www.linkedin.comhttp://www.linkedin.com/groups?gid=2104508&goback=%2Enpp_heriberto*5ruiz%2F64%2F344%2F7ab&trk=fulpro_grplogo""}, {""name""=>""Ranger School"", ""link""=>""http://www.linkedin.comhttp://www.linkedin.com/groups?gid=55533&goback=%2Enpp_heriberto*5ruiz%2F64%2F344%2F7ab&trk=fulpro_grplogo""}]","[{""name""=>""Cochise College"", ""description""=>""Associate of Arts and Sciences (A.A.S.), Intelligence Operations"", ""period""=>""2010 – 2015""}, {""name""=>""Nwfsc"", ""description""=>""Associate of Arts and Sciences (AAS), Criminal Justice"", ""period""=>""2012 – 2014""}, {""name""=>""St. Philip's College San Antonio TX"", ""description""=>""64 Credit Hrs, Criminal Justice and Corrections"", ""period""=>""2008 – 2009""}, {""name""=>""Laguardia Community College"", ""description""=>"""", ""period""=>""2001 – 2003""}]",[],http://www.linkedin.com/pub/heriberto-ruiz/64/344/7ab,"Active Top Secret/ SCI clearance with HCS/Gamma Provided Through Single Scope Background Investigation (SSBI). I have completed 8 years SIGINT analyst performance in different Areas of Operations. Skilled Intelligence Analyst with Tactical/Strategic organizational, analytical, and training abilities. Provided SIGINT support to Coalition Force elements through 24-hour watch operations. Utilized numerous IC databases and tipping tools to yield a number of reports daily. Experience in OEF extends to; Low Level Voice Interception (LLVI), Signal Terminal Guidance (STG), numerous program and various SIGINT databases search engines and disciplines. Task Force 3-10 Geospatial analysis while assisting the Tactical Screening Facility, ISR support and Air coordinations, Task-Force 3-10 target development. SIGINT analysis stateside as well as leading elements while providing (STG) SIGINT terminal guidance/VHF ground guidance to overseas in a high stress environment. My first deployment, as a SIGINT Analyst, I was the training NCOIC for the foreign soldiers, late comers to the deployment and anyone who needed assistance fixing equipment, configuring databases/or tools, as well as report- writing / Mission tasking / de-tasking priorities, while supporting air assets during combat operations. I was awarded the Army Joint Service Commendation Medal for my work as a Senior SIGINT Analyst, specifically, for providing accurate information during Combat Operations and preventing attacks to Forces. Completed two rotations to Afghanistan (OEF) as a Senior-Level Ground SIGINT Analyst Operator, and Geospatial Analyst for target development in 2009 and 2010. Additionally, I participated in numerous Objectives providing SIGINT/EW support to Task-Force Commander capturing and neutralizing many OBJs while developing new target packages.",No,2015-05-17 23:33:06 -0700,"[{""name""=>""Angie Minestra"", ""url""=>""https://www.linkedin.com/pub/angie-minestra/61/aa2/568?trk=pub-pbmap""}, {""name""=>""Carrie Collins"", ""url""=>""https://www.linkedin.com/pub/carrie-collins/20/310/9b1?trk=pub-pbmap""}, {""name""=>""Karl Weekes"", ""url""=>""https://www.linkedin.com/pub/karl-weekes/16/60/468?trk=pub-pbmap""}, {""name""=>""Lindsey Moore Lappin"", ""url""=>""https://www.linkedin.com/pub/lindsey-moore-lappin/14/654/70a?trk=pub-pbmap""}, {""name""=>""niko rivera"", ""url""=>""https://www.linkedin.com/pub/niko-rivera/62/814/220?trk=pub-pbmap""}, {""name""=>""Sammy Jackson"", ""url""=>""https://www.linkedin.com/pub/sammy-jackson/68/352/367?trk=pub-pbmap""}, {""name""=>""Heather Taylor"", ""url""=>""https://www.linkedin.com/pub/heather-taylor/46/765/28a?trk=pub-pbmap""}, {""name""=>""Shauna Brock"", ""url""=>""https://www.linkedin.com/pub/shauna-brock/29/54/2a8?trk=pub-pbmap""}, {""name""=>""Thomas Humphrey"", ""url""=>""https://www.linkedin.com/pub/thomas-humphrey/54/2b2/a67?trk=pub-pbmap""}]",0,public/uploads/pictures/0d3dff7.jpg,0
